{
  "schema_version": 1,
  "run_id": "sample-run-0001",
  "created_at": "2026-02-02T00:00:00Z",
  "status": "ok",
  "apply": false,
  "allowlist": [
    "station.status",
    "drift.check"
  ],
  "plan_steps": [
    { "step_id": "station.status", "agent": "station", "action_id": "station.status" },
    { "step_id": "drift.check", "agent": "drift", "action_id": "drift.check" },
    { "step_id": "assets.ensure", "agent": "assets", "action_id": null }
  ],
  "executed_steps": [
    {
      "step_id": "station.status",
      "agent": "station",
      "action_id": "station.status",
      "status": "skipped",
      "exit_code": null,
      "error": null,
      "started_at": "2026-02-02T00:00:01Z",
      "finished_at": "2026-02-02T00:00:01Z"
    }
  ],
  "skipped_steps": [
    { "step_id": "drift.check", "agent": "drift", "action_id": "drift.check", "reason": "dry_run" },
    { "step_id": "assets.ensure", "agent": "assets", "action_id": null, "reason": "no_action_ref" }
  ],
  "manual_steps": [
    { "step_id": "assets.ensure", "agent": "assets", "action_id": null }
  ],
  "failures": []
}
